<?xml version="1.0" encoding="ISO-8859-1"?>
<icat version="1.0 RC6" xsi:noNamespaceSchemaLocation="icatXSD.xsd" xmlns:xsi="http://www.w3.org/2001/XMLSchema-instance">
    <study>
        <name>DEVA_19946</name>
        <purpose>Group all Investigation per instrument and per year.</purpose>
        <status>ONGOING</status>
        <study_creation_date>2007-09-06T15:30:21</study_creation_date>
        <investigation trusted="true">
            <inv_number>194434961</inv_number>
            <visit_id>164463</visit_id>
            <instrument>GEM</instrument>
            <title>Temperature = 295 K</title>
            <investigator>    
                <user_id>tang76</user_id>
                <role>experimenter</role>
                <privilege>CREATOR</privilege>
                <affiliation_id>Tom</affiliation_id>
            </investigator>
            <investigator>    
                <user_id>dwf64</user_id>
                <role>experimenter</role>
                <privilege>CREATOR</privilege>
                <affiliation_id>9932</affiliation_id>
            </investigator>
            <inv_type>EXPERIMENT</inv_type>
            <bcat_inv_str>n/a</bcat_inv_str>
            <keyword>
                <name>a</name>
            </keyword>
            <keyword>
                <name>b</name>
            </keyword>
            <sample>
                <name>ALUMINIUM</name>
                <instance>0</instance>
                <chemical_formula>ALUMINIUM</chemical_formula>
                <safety_information>No information available.</safety_information>
                <parameter>
                    <name>sample_state</name>
                    <string_value>n/a</string_value>
                    <units>N/A</units>
                </parameter>
                <parameter>
                    <name>sample_situation</name>
                    <string_value>n/a</string_value>
                    <units>N/A</units>
                </parameter>
            </sample>
            <dataset>
                <name>default</name>
                <dataset_type>EXPERIMENT_RAW</dataset_type>
                <dataset_status>COMPLETE</dataset_status>
                <description>Magnetic Field = 0 Gauss</description>
                <sample>
                    <name>ALUMINIUM</name>
                    <instance>0</instance>
                    <chemical_formula>ALUMINIUM</chemical_formula>
                    <safety_information>No information available.</safety_information>
                    <parameter>
                        <name>sample_state</name>
                        <string_value>n/a</string_value>
                    <units>N/A</units></parameter>
                    <parameter>
                        <name>sample_situation</name>
                        <string_value>n/a</string_value>
                        <units>N/A</units>
                    </parameter>
                </sample>
                <datafile>
                    <name>00018.nxs</name>
                    <location>file://deva/1-9999/00018.nxs</location>
                    <description>Temperature, Sample</description>
                    <datafile_version>1.0</datafile_version>
                    <datafile_version_comment>First version</datafile_version_comment>
                    <datafile_format>NeXus</datafile_format>
                    <datafile_format_version>3.0.0</datafile_format_version>
                    <datafile_create_time>2007-08-21T12:58:24</datafile_create_time>
                    <datafile_modify_time>2007-08-21T12:58:24</datafile_modify_time>
                    <file_size>43352</file_size>
                    <parameter>
                        <name>run_number</name>
                        <numeric_value>120</numeric_value>
                        <units>decimal</units>
                        <description>Run Number</description>
                    </parameter>
                    <parameter>
                        <name>time_channel_parameters</name> 
                        <string_value>100 360 10</string_value> 
                        <units>N/A</units> 
                    </parameter>
                </datafile>
            </dataset>
        </investigation>
    </study>
</icat>
