<?xml version="1.0" encoding="ISO-8859-1"?>
<icat version="1.0 RC6" xsi:noNamespaceSchemaLocation="icatXSD.xsd" xmlns:xsi="http://www.w3.org/2001/XMLSchema-instance">
<study>
<name>MUSR_2006</name>
<purpose>Group all Investigation per instrument and per year.</purpose>
<status>ONGOING</status>
<study_creation_date>2007-09-13T12:58:06</study_creation_date>
<investigation trusted="false">
<inv_number>-1000</inv_number>
<visit_id>1</visit_id>
<instrument>MUSR</instrument>
<title>Ag T=300 F=50.0</title>
<inv_type>EXPERIMENT</inv_type>
<bcat_inv_str>PI : -</bcat_inv_str>
<dataset>
<name>Default</name>
<dataset_type>EXPERIMENT_RAW</dataset_type>
<dataset_status>COMPLETE</dataset_status>
<description> Title =Ag T=300 F=50.0 Note =Slits=25</description>
<sample>
<name>Ag</name>
<instance>0</instance>
<safety_information>No information available.</safety_information>
<parameter>
<name>sample_description</name>
<string_value>plate</string_value>
<units>N/A</units></parameter></sample>
<datafile>
<name>musr00012702_v2.nxs</name>
<location>test_data/Muon/musr00012702_v2.nxs</location>
<description> Title =Ag T=300 F=50.0 Note =Slits=25</description>
<datafile_version>1.0</datafile_version>
<datafile_version_comment>First version</datafile_version_comment>
<datafile_format>NeXus</datafile_format>
<datafile_format_version>4.0.0</datafile_format_version>
<datafile_create_time>2006-11-06T15:21:44</datafile_create_time>
<datafile_modify_time>2007-08-01T09:56:51</datafile_modify_time>
<file_size>557537</file_size>
<command>NXtranslate - -</command>
<parameter>
<name>run_number</name>
<numeric_value>12702</numeric_value>
<units>N/A</units>
<description>Run Number</description></parameter>
<parameter>
<name>hdf_format</name>
<string_value>NCSA HDF Version 4.2 Release 1, February 17, 2005</string_value>
<units>N/A</units>
<description>version of HDF library used by nexus to create file</description></parameter>
<parameter>
<name>idf_version</name>
<string_value>2</string_value>
<units>N/A</units>
<description>version of IDF that NeXus file confirms to</description></parameter>
<parameter>
<name>program_name</name>
<string_value>NXtranslate</string_value>
<units>N/A</units>
<description>Name of creating program.</description></parameter>
<parameter>
<name>program_version</name>
<string_value>0.3.0</string_value>
<units>N/A</units>
<description>Version of creating program.</description></parameter>
<parameter>
<name>nexus_definition</name>
<string_value>pulsedTD</string_value>
<units>N/A</units>
<description>specified the template (DTD name) on which the entry was based, e.g. 'pulsedTD' (pulsed muon, time differential).</description></parameter>
<parameter>
<name>creator</name>
<string_value>ISIS</string_value>
<units>N/A</units>
<description>facility or program where file originated.</description></parameter>
<parameter>
<name>start_date</name>
<string_value>2006-11-06 15:21:44+0000</string_value>
<units>yyyy-MM-dd HH:mm:ss</units>
<description>Start Time of the dataset.</description></parameter>
<parameter>
<name>finish_date</name>
<string_value>2006-11-06 15:48:52+0000</string_value>
<units>yyyy-MM-dd HH:mm:ss</units>
<description>Start Time of the dataset.</description></parameter>
<parameter>
<name>run_duration</name>
<numeric_value>1628</numeric_value>
<units>seconds</units>
<description>Duration of measurement.</description></parameter>
<parameter>
<name>number_periods</name>
<numeric_value>1</numeric_value>
<units>N/A</units>
<description>number of periods used.</description></parameter>
<parameter>
<name>good_frames</name>
<numeric_value>1973</numeric_value>
<units>N/A</units>
<description>total good frames collected in all periods.</description></parameter>
<parameter>
<name>total_counts</name>
<numeric_value>400197.000000</numeric_value>
<units>N/A</units>
<description>total counts collected in all periods</description></parameter>
<parameter>
<name>facility_name</name>
<string_value>ISIS</string_value>
<units>N/A</units>
<description>facility name</description></parameter>
<parameter>
<name>instrument_name</name>
<string_value>MUSR</string_value>
<units>N/A</units>
<description>facility name</description></parameter>
<parameter>
<name>source_type</name>
<string_value>pulsed muon source</string_value>
<units>N/A</units></parameter>
<parameter>
<name>probe</name>
<string_value>positive muons</string_value>
<units>N/A</units></parameter>
<parameter>
<name>sample_magnetic_field_state</name>
<string_value>TF</string_value>
<units>N/A</units>
<description>Magnetic field mode, e.g. TF, LF, ZF</description></parameter>
<parameter>
<name>bcat_inv_str</name>
<string_value>PI : -</string_value>
<units>N/A</units></parameter></datafile></dataset></investigation></study></icat>
