<?xml version="1.0" encoding="ISO-8859-1"?>
<icat version="1.0 RC6" xsi:noNamespaceSchemaLocation="icatXSD.xsd" xmlns:xsi="http://www.w3.org/2001/XMLSchema-instance">
<study>
<name>MUSR_2006</name>
<purpose>Group all Investigation per instrument and per year.</purpose>
<status>ONGOING</status>
<study_creation_date>2007-09-13T12:58:02</study_creation_date>
<investigation trusted="false">
<inv_number>-1000</inv_number>
<visit_id>1</visit_id>
<instrument>MUSR</instrument>
<title>Fe T=100 F=20.0</title>
<inv_type>EXPERIMENT</inv_type>
<bcat_inv_str>Aidy</bcat_inv_str>
<dataset>
<name>Default</name>
<dataset_type>EXPERIMENT_RAW</dataset_type>
<dataset_status>COMPLETE</dataset_status>
<description> Title =Fe T=100 F=20.0 Note =Slits=25</description>
<sample>
<name>Fe</name>
<instance>0</instance>
<chemical_formula>Fe</chemical_formula>
<safety_information>No information available.</safety_information>
<parameter>
<name>sample_state</name>
<string_value>pow</string_value>
<units>N/A</units></parameter>
<parameter>
<name>sample_situation</name>
<string_value>CCR</string_value>
<units>N/A</units></parameter></sample>
<datafile>
<name>MUSR00009145.nxs</name>
<location>test_data/Muon/MUSR00009145.nxs</location>
<description>Fe T=100 F=20.0</description>
<datafile_version>1.0</datafile_version>
<datafile_version_comment>First version</datafile_version_comment>
<datafile_format>NeXus</datafile_format>
<datafile_format_version>2.1.0</datafile_format_version>
<datafile_create_time>2006-04-04T23:15:29</datafile_create_time>
<datafile_modify_time>2006-04-04T23:36:07</datafile_modify_time>
<file_size>609353</file_size>
<parameter>
<name>run_number</name>
<numeric_value>9145</numeric_value>
<units>N/A</units>
<description>Run Number</description></parameter>
<parameter>
<name>nexus_version</name>
<string_value>2.1.0</string_value>
<units>N/A</units>
<description>NeXus version used to create the file.</description></parameter>
<parameter>
<name>hdf_version</name>
<string_value>NCSA HDF Version 4.1 Release 5, November 5, 2001</string_value>
<units>N/A</units>
<description>HDF Version used to create the file.</description></parameter>
<parameter>
<name>program_name</name>
<string_value>ICP</string_value>
<units>N/A</units>
<description>Name of creating program.</description></parameter>
<parameter>
<name>program_version</name>
<string_value>v1</string_value>
<units>N/A</units>
<description>version of creating program.</description></parameter>
<parameter>
<name>start_date</name>
<string_value>2006-04-04 23:15:29+0000</string_value>
<units>yyyy-MM-dd HH:mm:ss</units>
<description>Start Time of the dataset.</description></parameter>
<parameter>
<name>finish_date</name>
<string_value>2006-04-04 23:36:07+0000</string_value>
<units>yyyy-MM-dd HH:mm:ss</units>
<description>Start Time of the dataset.</description></parameter>
<parameter>
<name>run_duration</name>
<numeric_value>1238</numeric_value>
<units>seconds</units>
<description>Calculated duration.</description></parameter>
<parameter>
<name>switching_states</name>
<string_value>1</string_value>
<units>N/A</units>
<description>1 = Normal data collection, 2 = Red/Green mode</description></parameter>
<parameter>
<name>sample_temperature_setting</name>
<numeric_value>100.000000</numeric_value>
<units>Kelvin</units>
<description>Desired temperature</description></parameter>
<parameter>
<name>sample_magnetic_field_setting</name>
<numeric_value>20.000000</numeric_value>
<units>Gauss</units>
<description>Desired Magnetic field</description></parameter>
<parameter>
<name>sample_magnetic_field_state</name>
<string_value>TF</string_value>
<units>N/A</units>
<description>Magnetic field mode, e.g. TF</description></parameter>
<parameter>
<name>detector_orientation</name>
<string_value>l</string_value>
<units>N/A</units>
<description>Detector arrangement. longitudinal 'l' or Transverse 't'</description></parameter>
<parameter>
<name>collimator_type</name>
<string_value>Slits</string_value>
<units>N/A</units>
<description>Collimator type. e.g. slits</description></parameter>
<parameter>
<name>source_total_count</name>
<numeric_value>10.090789</numeric_value>
<units>Mev</units>
<description>Total number of counts.</description></parameter>
<parameter>
<name>source_daereads</name>
<numeric_value>1</numeric_value>
<units>N/A</units>
<description>number of readout from the DAE.</description></parameter>
<parameter>
<name>source_frames</name>
<numeric_value>61828</numeric_value>
<units>N/A</units>
<description>ISIS frames collected on each DAE read.</description></parameter>
<parameter>
<name>data_avg_counts</name>
<numeric_value>2</numeric_value>
<units>counts</units>
<description>Average of number of counts in histogram_data_1.</description></parameter>
<parameter>
<name>data_std_counts</name>
<numeric_value>198.274</numeric_value>
<units>counts</units>
<description>Standard deviation of number of counts in histogram_data_1.</description></parameter>
<parameter>
<name>histogram_resolution</name>
<numeric_value>16000</numeric_value>
<units>picoseconds</units>
<description>Histogram resolution. set to 0 if not applicable.</description></parameter>
<parameter>
<name>time_zero</name>
<numeric_value>0.206000</numeric_value>
<units>microseconds</units>
<description>Time zero for muon measurement.</description></parameter>
<parameter>
<name>temperature_avg</name>
<numeric_value>91.413582</numeric_value>
<units>kelvin</units>
<description> Average of :Temp_Sample</description></parameter>
<parameter>
<name>temperature_std</name>
<numeric_value>2.21598</numeric_value>
<units>kelvin</units>
<description> Standard deviation of :Temp_Sample</description></parameter>
<parameter>
<name>bcat_inv_str</name>
<string_value>Aidy</string_value>
<units>N/A</units></parameter></datafile></dataset></investigation></study></icat>
