<?xml version="1.0" encoding="ISO-8859-1"?>
<icat version="1.0 RC6" xsi:noNamespaceSchemaLocation="icatXSD.xsd" xmlns:xsi="http://www.w3.org/2001/XMLSchema-instance">
	<study>
		<name>study-test-1</name>
		<purpose>Test the XML Schema</purpose>
		<status>ONGOING</status>
		<related_material>The schema named icatIngest.xsd is certainly related material.</related_material>
		<study_creation_date>2006-03-02T13:24:10Z</study_creation_date>
		<study_manager>ll56</study_manager>
		<investigation>
			<inv_number>000001</inv_number>
			<visit_id>01</visit_id>
			<instrument>MUSR</instrument>
			<title>test investigation to test the XML schema.</title>
			<investigator>
				<user_id>ll56</user_id>
				<role>tester, developer</role>
				<title>Mr.</title>
				<initials>L. L.</initials>
				<first_name>Laurent</first_name>
				<last_name>Lerusse</last_name>
				<affiliation> CCLRC - e-Science Center - Facility Support Group - Data Management Group</affiliation>
				<affiliation_id>CCLRC-ESC-EDM</affiliation_id>
			</investigator>
			<investigator>
				<user_id>lhe430</user_id>
				<role> Principal Investigator</role>
				<title>Miss.</title>
				<initials> L. H. E.</initials>
				<first_name>Lisa</first_name>
				<middle_name>Hedwidge</middle_name>
				<last_name> Eccles</last_name>
				<affiliation> CCLRC - e-Science Center - Data Management Group</affiliation>
				<affiliation_id>CCLRC-ESC-EDM</affiliation_id>
			</investigator>
			<inv_abstract>Dummy investigation to verify the XML schema that will be used as a validation of the input of the XML ingestion</inv_abstract>
			<inv_type>EXPERIMENT</inv_type>
			<prev_inv_number> ????</prev_inv_number>
			<bcat_inv_str>Not sure what this parameter is.</bcat_inv_str>
			<grant_id>CCLRC_2006-001</grant_id>
			<facility_cycle>cycle_07_02</facility_cycle>
			<keyword><name>test</name></keyword>
			<keyword><name>xml</name></keyword>
			<keyword><name>xsd</name></keyword>
			<keyword><name>icat</name></keyword>
			<keyword><name>ingestion</name></keyword>
			<keyword><name>0.1</name></keyword>
				<topic>
					<name>XML</name>
					<topic_level>1</topic_level>
				</topic>
				<topic>
					<name>Schema</name>
					<topic_level>1</topic_level>
				</topic>
				<topic>
					<name>Ingestion</name>
					<topic_level>2</topic_level>
				</topic>
			
			
				
			
			<dataset>
				<name>test-1</name>
				<dataset_type>EXPERIMENT_RAW</dataset_type>
				<dataset_status>COMPLETE</dataset_status>
				<description>test dataset number 1</description>
				<sample>
					<name>sample A</name>
					<instance>1</instance>
					<chemical_formula>H2O</chemical_formula>
					<safety_information>Unsafe, can be full of germs, better drink beer.</safety_information>
					<parameter>
						<name>quantity</name>
						<numeric_value>1.5</numeric_value>
						<units>pints</units>
						<range_top>5</range_top>
						<range_bottom>.5</range_bottom>
						<error>.2</error>
						<description>How much should we drink per day</description>
					</parameter>
					<parameter>
						<name>notes</name>
						<string_value> transparent</string_value>
						<units>N/A</units>
						<description> color of the water</description>
					</parameter>					
				</sample>
				<datafile>
					<name>file_01.nxs</name>
					<location>/test/inv_1/file_01.nxs</location>
					<description>test nexus file 1</description>
					<datafile_version>3.0.0</datafile_version>
					<datafile_version_comment>Just imagined</datafile_version_comment>
					<datafile_format>nexus</datafile_format>
					<datafile_create_time>2007-03-02T13:48:00Z</datafile_create_time>
					<datafile_modify_time>2007-03-02T13:48:00Z</datafile_modify_time>
					<parameter>
						<name>good_frames</name>
						<numeric_value>31</numeric_value>
						<units>pulses</units>
					</parameter>
					<parameter>
						<name>run_title</name>
						<string_value>Nerds run riot at JavaOne</string_value>
						<units>N/A</units>
						<description>Compression parameter used in Photoshop.</description>
					</parameter>
                                        <parameter>
						<name>run_number</name>
						<numeric_value>1</numeric_value>
						<units>N/A</units>						
					</parameter>                                        
				</datafile>				
			</dataset>
		</investigation>
	</study>
</icat>