<?xml version="1.0" encoding="ISO-8859-1"?>
<icat version="1.0 RC6" xsi:noNamespaceSchemaLocation="icatXSD.xsd" xmlns:xsi="http://www.w3.org/2001/XMLSchema-instance">
<study>
<name>MUSR_2003</name>
<purpose>Group all Investigation per instrument and per year.</purpose>
<status>ONGOING</status>
<study_creation_date>2007-09-13T12:57:59</study_creation_date>
<investigation trusted="false">
<inv_number>13774</inv_number>
<visit_id>1</visit_id>
<instrument>MUSR</instrument>
<title>Temperature = 1.3 K, Magnetic Field = 10 Gauss, Sample = KA9</title>
<inv_type>EXPERIMENT</inv_type>
<bcat_inv_str>ORSAY</bcat_inv_str>
<dataset>
<name>Default</name>
<dataset_type>EXPERIMENT_RAW</dataset_type>
<dataset_status>COMPLETE</dataset_status>
<description> Title =Temperature = 1.3 K, Magnetic Field = 10 Gauss, Sample = KA9 Note =lf10</description>
<sample>
<name>KA99</name>
<instance>0</instance>
<chemical_formula>KA99</chemical_formula>
<safety_information>No information available.</safety_information>
<parameter>
<name>sample_shape</name>
<string_value>n/a</string_value>
<units>N/A</units></parameter>
<parameter>
<name>sample_situation</name>
<string_value>BLUE3</string_value>
<units>N/A</units></parameter></sample>
<datafile>
<name>50290.nxs</name>
<location>test_data/Muon/50290.nxs</location>
<description>Temperature = 1.3 K, Magnetic Field = 10 Gauss, Sample = KA9</description>
<datafile_version>1.0</datafile_version>
<datafile_version_comment>First version</datafile_version_comment>
<datafile_format>NeXus</datafile_format>
<datafile_format_version>1.3.2</datafile_format_version>
<datafile_create_time>2003-06-29T14:49:15</datafile_create_time>
<datafile_modify_time>2003-06-29T15:25:31</datafile_modify_time>
<file_size>296321</file_size>
<parameter>
<name>run_number</name>
<numeric_value>50290</numeric_value>
<units>N/A</units>
<description>Run Number</description></parameter>
<parameter>
<name>nexus_version</name>
<string_value>1.3.2</string_value>
<units>N/A</units>
<description>NeXus version used to create the file.</description></parameter>
<parameter>
<name>program_name</name>
<string_value>MCS</string_value>
<units>N/A</units>
<description>Name of creating program.</description></parameter>
<parameter>
<name>program_version</name>
<string_value>RD</string_value>
<units>N/A</units>
<description>version of creating program.</description></parameter>
<parameter>
<name>start_date</name>
<string_value>2003-06-29 14:49:15+0000</string_value>
<units>yyyy-MM-dd HH:mm:ss</units>
<description>Start Time of the dataset.</description></parameter>
<parameter>
<name>finish_date</name>
<string_value>2003-06-29 15:24:42+0000</string_value>
<units>yyyy-MM-dd HH:mm:ss</units>
<description>Start Time of the dataset.</description></parameter>
<parameter>
<name>run_duration</name>
<numeric_value>2127</numeric_value>
<units>seconds</units>
<description>Calculated duration.</description></parameter>
<parameter>
<name>switching_states</name>
<string_value>1</string_value>
<units>N/A</units>
<description>1 = Normal data collection, 2 = Red/Green mode</description></parameter>
<parameter>
<name>sample_temperature_setting</name>
<numeric_value>1.300000</numeric_value>
<units>kelvin</units>
<description>Desired temperature</description></parameter>
<parameter>
<name>sample_magnetic_field_setting</name>
<numeric_value>10.000000</numeric_value>
<units>gauss</units>
<description>Desired Magnetic field</description></parameter>
<parameter>
<name>sample_magnetic_field_state</name>
<string_value>LF</string_value>
<units>N/A</units>
<description>Magnetic field mode, e.g. TF</description></parameter>
<parameter>
<name>detector_orientation</name>
<string_value>l</string_value>
<units>N/A</units>
<description>Detector arrangement. longitudinal 'l' or Transverse 't'</description></parameter>
<parameter>
<name>collimator_type</name>
<string_value>Slits</string_value>
<units>N/A</units>
<description>Collimator type. e.g. slits</description></parameter>
<parameter>
<name>source_total_count</name>
<numeric_value>11.578413</numeric_value>
<units>Mev</units>
<description>Total number of counts.</description></parameter>
<parameter>
<name>source_daereads</name>
<numeric_value>19</numeric_value>
<units>N/A</units>
<description>number of readout from the DAE.</description></parameter>
<parameter>
<name>source_frames</name>
<numeric_value>95000</numeric_value>
<units>N/A</units>
<description>ISIS frames collected on each DAE read.</description></parameter>
<parameter>
<name>data_avg_counts</name>
<numeric_value>0</numeric_value>
<units>counts</units>
<description>Average of number of counts in histogram_data_1.</description></parameter>
<parameter>
<name>data_std_counts</name>
<numeric_value>475.653</numeric_value>
<units>counts</units>
<description>Standard deviation of number of counts in histogram_data_1.</description></parameter>
<parameter>
<name>histogram_resolution</name>
<numeric_value>16000.000000</numeric_value>
<units>picoseconds</units>
<description>Histogram resolution. set to 0 if not applicable.</description></parameter>
<parameter>
<name>time_zero</name>
<numeric_value>0.645000</numeric_value>
<units>microseconds</units>
<description>Time zero for muon measurement.</description></parameter>
<parameter>
<name>temperature_avg</name>
<numeric_value>1.312000</numeric_value>
<units>kelvin</units>
<description> Average of :sample temperature</description></parameter>
<parameter>
<name>temperature_std</name>
<numeric_value>0.0933345</numeric_value>
<units>kelvin</units>
<description> Standard deviation of :sample temperature</description></parameter>
<parameter>
<name>bcat_inv_str</name>
<string_value>ORSAY</string_value>
<units>N/A</units></parameter></datafile></dataset></investigation></study></icat>
